{
  "$schema": "http://json-schema.org/draft-04/schema#",
  "title": "RoadConditionStatus",
  "id": "roadConditionStatus.json",
  "type": "object",
  "required": ["Domain", "Id", "EntityType", "SchemaVersion", "data"],
  "properties": {
    "Domain": {
      "type": "string"
    },
    "Id": {
      "type": "string"
    },
    "EntityType": {
      "type": "string"
    },
    "SchemaVersion": {
      "type": "number"
    },
    "data": {
      "allOf": [
        {
          "$ref": "geojson.json"
        },
        {
          "$ref": "definitions.json#/definitions/roadConditionStatus"
        },
        {
          "$ref": "definitions.json#/definitions/geojsonProperties"
        }
      ]
    }
  }
}